{
  "$schema": "https://json-schema.org/draft/2020-12/schema",
  "$id": "https://teploy.github.io/contracts/schema/release-record.schema.json",
  "title": "releasemeta Record (F14; releasemeta.go Record)",
  "type": "object",
  "required": [
    "schema_version",
    "app",
    "hash",
    "created_at",
    "deployment_type",
    "ingress_mode"
  ],
  "properties": {
    "schema_version": {
      "type": "integer",
      "minimum": 1
    },
    "app": {
      "type": "string",
      "minLength": 1
    },
    "hash": {
      "type": "string",
      "pattern": "^[A-Za-z0-9_][A-Za-z0-9._-]{0,127}$"
    },
    "created_at": {
      "type": "string",
      "format": "date-time"
    },
    "backfilled": {
      "type": "boolean"
    },
    "generation": {
      "type": "integer",
      "minimum": 0
    },
    "deployment_type": {
      "type": "string",
      "enum": [
        "container",
        "static"
      ]
    },
    "ingress_mode": {
      "type": "string"
    },
    "domain": {
      "type": "string"
    },
    "image_ref": {
      "type": "string"
    },
    "image_digest": {
      "type": "string"
    },
    "manifest_sha256": {
      "type": "string"
    },
    "provenance": {
      "type": [
        "object",
        "null"
      ]
    },
    "volume_ownership": {
      "type": "object",
      "additionalProperties": {
        "type": "object",
        "required": [
          "uid",
          "gid",
          "mode"
        ],
        "properties": {
          "uid": {
            "type": "integer",
            "minimum": 0,
            "maximum": 4294967294
          },
          "gid": {
            "type": "integer",
            "minimum": 0,
            "maximum": 4294967294
          },
          "mode": {
            "type": "string",
            "pattern": "^0[0-7]{2}[0145]$"
          }
        }
      }
    },
    "config_commit": {
      "type": "string",
      "pattern": "^[0-9a-f]{40}$",
      "description": "Teploy-home deploys: the config.git commit the release was loaded from (rev 11). Absent for folder-home deploys."
    },
    "actor": {
      "type": "string",
      "description": "Client that deployed the release, <client>[:<label>] (client-asserted, rev 11)."
    },
    "source_sha256": {
      "type": "string",
      "pattern": "^[0-9a-f]{64}$",
      "description": "Folder-home deploys: sha256 of meta/<hash>.source.yml, the deployed teploy.yml with detected secret values masked (rev 12). Show that file as the applied config only when its digest matches."
    }
  }
}
