{
  "schema_version": 1,
  "app": "myapp",
  "hash": "abc1234.deadb17ecafef00d",
  "created_at": "2026-09-23T12:00:00Z",
  "deployment_type": "container",
  "ingress_mode": "caddy",
  "domain": "myapp.example.com",
  "image_ref": "nginx:1.27",
  "image_digest": "sha256:0000",
  "manifest_sha256": "sha256:beef"
}
