{
  "schema_version": 1,
  "app": "blog",
  "hash": "1.4.0",
  "created_at": "2026-10-19T12:00:00Z",
  "deployment_type": "container",
  "ingress_mode": "caddy",
  "domain": "blog.example.com",
  "image_ref": "example/blog:1.4.0",
  "image_digest": "sha256:0000",
  "manifest_sha256": "sha256:beef",
  "config_commit": "8f2c1d0e9b7a6f5e4d3c2b1a0f9e8d7c6b5a4f3e",
  "actor": "dash:alice"
}
